{"artifacts":[],"baseRevision":"8e61c9ebc915ee3139a660b166160d39fd9fc3b8","criterionBindings":[],"criterionLinks":[],"evidence":[{"blobOid":"04f53d591eb6804a078a2704d20951769737a778","id":"evidence:sha256:0c71ac928aa52822b50e4ef9b778e5c343ff56076e9786f0aea789360e5ca5d5","path":"internal/testsource/seed_parity_test.go","span":{"end":6339,"start":5210},"spanSha256":"6a5a0798cdd581376533a07a9716d17b0489d07676b3ddc18bda671847c19b8f"},{"blobOid":"e8555ac7ae22a21108f36520e744be79c8fecf47","id":"evidence:sha256:dab95e7974142eb4a1d2704bb21c8329755e09c0470ab3b08510a7bce95a6ccb","path":"internal/testsource/seed_parity.go","span":{"end":6182,"start":5737},"spanSha256":"72b4e5af32328095ee0d0ae21e61868e5866aaa639cc5b1ea5c79f1140efd2fb"},{"blobOid":"a2537b75acb71796268b552cbdbd1fe2f1a9bc09","id":"evidence:sha256:f637dc61ba25621e46a760b94f8eb44ae99fdc54c508def7d5785fffb00cab67","path":"docs/build-log/2026-10-18-V1-1883-seed-parity.md","span":{"end":1929,"start":0},"spanSha256":"c926e305245625acb79fe8fb7731e409033ec9c5d350f1e318e7d0ab5c435b3b"}],"excludedPath":".corvint/change.cem.json","hunks":[{"basis":[{"evidenceId":"evidence:sha256:0c71ac928aa52822b50e4ef9b778e5c343ff56076e9786f0aea789360e5ca5d5","relation":"test-claim"}],"disposition":"supported","id":"hunk:sha256:b23718fbb6b92f362813c4a3a0e781424a4735379a86391295f8f331036beb1c","newRange":{"count":14,"start":29},"oldRange":{"count":6,"start":29},"path":"internal/testsource/seed_parity_rspec.go","reason":"evidence-backed"},{"basis":[{"evidenceId":"evidence:sha256:dab95e7974142eb4a1d2704bb21c8329755e09c0470ab3b08510a7bce95a6ccb","relation":"call-site"}],"disposition":"supported","id":"hunk:sha256:b041b9e2d669e8d00671da3667863098fd0c1dc267456ffd7ad561d0322da105","newRange":{"count":10,"start":42},"oldRange":{"count":6,"start":42},"path":"internal/testsource/validity_rspec.go","reason":"evidence-backed"},{"basis":[{"evidenceId":"evidence:sha256:f637dc61ba25621e46a760b94f8eb44ae99fdc54c508def7d5785fffb00cab67","relation":"decision"}],"disposition":"supported","id":"hunk:sha256:2129a21688ca253053fdb2e7211040a47f7e289266aa94358899ab08a4717247","newRange":{"count":6,"start":53},"oldRange":{"count":18,"start":49},"path":"internal/testsource/validity_rspec.go","reason":"evidence-backed"}],"patchSha256":"62a07cfbaa15df1d67568ed02bb25c431c979373bd8cc0baff3fd436b2e1cd79","runnerReceipts":[],"spec":"cem/1.0"}
