{"artifacts":[],"baseRevision":"e0a5521cf552dd7549fe13d01b514be97c97a687","criterionBindings":[],"criterionLinks":[],"evidence":[{"blobOid":"81230367670143e934208849f43c3d0503f5d638","id":"evidence:sha256:dd886407f3012c0f921309bd7a44393c2ebc552a124961d82cbb5d3d4c2265fa","path":"docs/specs/spec-toolchain-adapters-v0.md","span":{"end":7838,"start":7695},"spanSha256":"2da1ff0daba6ae85b08f1b6b466a5c05be0eb08a9bb6935e2dbfe3cc8d41bcd7"}],"excludedPath":".corvint/change.cem.json","hunks":[{"basis":[{"evidenceId":"evidence:sha256:dd886407f3012c0f921309bd7a44393c2ebc552a124961d82cbb5d3d4c2265fa","relation":"specification"}],"disposition":"supported","id":"hunk:sha256:439c02fb9b40a4bcb06884d1e64f31f61c2378d8acc1d5cc79a32c196303ecc0","newRange":{"count":10,"start":1},"oldRange":{"count":0,"start":0},"path":"docs/build-log/2026-10-18-v1-1695-sta-path-classification-closeout.md","reason":"evidence-backed"}],"patchSha256":"fb32e42bf2a76d1ff517885b8a3af5f86e8056bd51d696776fff160d53f701fe","runnerReceipts":[],"spec":"cem/1.0"}
