{"artifacts":[],"baseRevision":"253bc9a1dcf3284cca302aa320f57310d3a8673a","criterionBindings":[],"criterionLinks":[],"evidence":[{"blobOid":"4a9af7c68c145ace6951dda04afa722d7b372de6","id":"evidence:sha256:06723918c1943c548783c5a3638943231c68c451708b5cbfd2f3b014a74c9c46","path":"internal/cem/workflow/workflow.go","span":{"end":8745,"start":8501},"spanSha256":"a46403cdbfe6b0a18735bca4e8b97b611144303025cbaa91013200a35c172628"},{"blobOid":"a371845bf3fb512b9b10fc3447225a88c350a949","id":"evidence:sha256:e938a358d565d49a1ff2eb36669e8d7b05a7a1fb00080b72524084c4aee9a13c","path":"AGENTS.md","span":{"end":4082,"start":3781},"spanSha256":"66bd3fd68b6179557cabb27f57c3746f487a3177a7f42a6b3c85f843e678d1e9"},{"blobOid":"03cc0872cfb612357af86717e65655eb118de35d","id":"evidence:sha256:a5ea8277078f1b8ac523ba8288451f02c073f2a86e2c7a78fc6cab33c8d8285a","path":"Makefile","span":{"end":17368,"start":16914},"spanSha256":"c28bdfc9f313d66787ed2d35139b949bbda8a80c9a499c0f8faa34e6e149802d"},{"blobOid":"03cc0872cfb612357af86717e65655eb118de35d","id":"evidence:sha256:5fc83b7fdeac3f93735551a352c484eb7e2a418f625403da1b28c8cb414afee2","path":"Makefile","span":{"end":12658,"start":12470},"spanSha256":"75e489a6134769c49a61b2ab18ba59e1cb38c2e3725f8bfdec97c197b5b7c050"},{"blobOid":"a371845bf3fb512b9b10fc3447225a88c350a949","id":"evidence:sha256:793d23616a9a8743e71fd6b479ce4a30e56e67ab4e578124645e119e18ac93d8","path":"AGENTS.md","span":{"end":3265,"start":2977},"spanSha256":"29bf8bf25de6e19c57bfee2b1fc98c3d85cbeabf2157578740a5eae467b3c916"},{"blobOid":"a371845bf3fb512b9b10fc3447225a88c350a949","id":"evidence:sha256:978b430bb8ba2838c7e5820bf3db2b216a66f4efaf731de7fd9faa5b1ccab57c","path":"AGENTS.md","span":{"end":3780,"start":3266},"spanSha256":"c7d11a0b982eb2201635eb2b707b8cdd00d1293b759e09871c243197f41ca672"},{"blobOid":"7494070dc30041a884e3ca1ec34a79735706f7ef","id":"evidence:sha256:181df72f2c5948050b2218000c36d3c898818942b2a7f67c4496d6818ebd3f82","path":"internal/cem/cli/stable_read_test.go","span":{"end":6762,"start":5908},"spanSha256":"50c3115d55ff9abcdba37e16f6b275bd457b161c4a2d3a8a3e33a7e82da8b494"},{"blobOid":"8b88b51cfc71b35cdf869e67c0bd9d4a2f62b91c","id":"evidence:sha256:d39170c99ef6c6a201635fe9dfcbdaa0799d4eab87e99620f3a1eb35e10b331b","path":"internal/cem/publish/publish.go","span":{"end":4199,"start":3591},"spanSha256":"548b059e873ccf539b11961e61befc1a7f41b54235fbbc979e5ddec280834c55"},{"blobOid":"a371845bf3fb512b9b10fc3447225a88c350a949","id":"evidence:sha256:1078611d55712ce55d2b8c939cfcec0e8ef210cc4975d02af0b5dbeda9b27e6d","path":"AGENTS.md","span":{"end":1572,"start":1377},"spanSha256":"f5f2d03e50b46beadc24b2530570e860080388140616a8297ff4cf93c910152b"},{"blobOid":"8b88b51cfc71b35cdf869e67c0bd9d4a2f62b91c","id":"evidence:sha256:da3bdac3a5bba9a7b83706df96b1efa2d3d8bec49631ed85ca921a1bb2e14256","path":"internal/cem/publish/publish.go","span":{"end":1992,"start":1490},"spanSha256":"8b65570e2216f08b1b2ed6a7a799c3493533a49897bcd477bca4a67de77b26e9"}],"excludedPath":".corvint/change.cem.json","hunks":[{"basis":[{"evidenceId":"evidence:sha256:06723918c1943c548783c5a3638943231c68c451708b5cbfd2f3b014a74c9c46","relation":"specification"}],"disposition":"supported","id":"hunk:sha256:df39eb31daa6c07c6672a835de99eaaf2bb2f7784b2aced5f6265ea5c19f80b6","newRange":{"count":35,"start":1},"oldRange":{"count":0,"start":0},"path":"cmd/corvint/cem_map_path_help_test.go","reason":"evidence-backed"},{"basis":[{"evidenceId":"evidence:sha256:06723918c1943c548783c5a3638943231c68c451708b5cbfd2f3b014a74c9c46","relation":"specification"}],"disposition":"supported","id":"hunk:sha256:d52e6a04d45540d15cb20221bf69513dbe30fb33041fa7a547aa7dbb87c93c96","newRange":{"count":18,"start":1099},"oldRange":{"count":6,"start":1099},"path":"cmd/corvint/help.go","reason":"evidence-backed"},{"basis":[{"evidenceId":"evidence:sha256:e938a358d565d49a1ff2eb36669e8d7b05a7a1fb00080b72524084c4aee9a13c","relation":"specification"}],"disposition":"supported","id":"hunk:sha256:9078f95a945440b33441eed76873adb151ee957ac89364a3565db8b1ea2b0dfd","newRange":{"count":31,"start":1},"oldRange":{"count":0,"start":0},"path":"docs/build-log/2026-10-20-V1-2097-out-of-tree-map-reads.md","reason":"evidence-backed"},{"basis":[{"evidenceId":"evidence:sha256:a5ea8277078f1b8ac523ba8288451f02c073f2a86e2c7a78fc6cab33c8d8285a","relation":"specification"}],"disposition":"supported","id":"hunk:sha256:5dd389276ace95bb799992b7e268d1e893d316d1134e090a5a6e5a3bff9908e2","newRange":{"count":7,"start":254},"oldRange":{"count":7,"start":254},"path":"docs/specs/FRONTIER-DECISION-BRIEF-2026-08-29.md","reason":"evidence-backed"},{"basis":[{"evidenceId":"evidence:sha256:5fc83b7fdeac3f93735551a352c484eb7e2a418f625403da1b28c8cb414afee2","relation":"specification"}],"disposition":"supported","id":"hunk:sha256:13298daef50ef11babad7999586b1b1ef74aeac0d205ca6af93a4717e374e05e","newRange":{"count":9,"start":863},"oldRange":{"count":6,"start":863},"path":"docs/specs/REQUIREMENTS.tsv","reason":"evidence-backed"},{"basis":[{"evidenceId":"evidence:sha256:793d23616a9a8743e71fd6b479ce4a30e56e67ab4e578124645e119e18ac93d8","relation":"specification"}],"disposition":"supported","id":"hunk:sha256:a423fabb66d522ae86fe31689516ae86a02e8ca781b333179fbcb500bda770e0","newRange":{"count":7,"start":6},"oldRange":{"count":7,"start":6},"path":"docs/specs/cem-stable-v1.md","reason":"evidence-backed"},{"basis":[{"evidenceId":"evidence:sha256:978b430bb8ba2838c7e5820bf3db2b216a66f4efaf731de7fd9faa5b1ccab57c","relation":"specification"}],"disposition":"supported","id":"hunk:sha256:5702f5189f220cb4c2c3c2411164a08d99b779c193bb5aad5d44914894457b6a","newRange":{"count":68,"start":3354},"oldRange":{"count":3,"start":3354},"path":"docs/specs/cem-stable-v1.md","reason":"evidence-backed"},{"basis":[{"evidenceId":"evidence:sha256:181df72f2c5948050b2218000c36d3c898818942b2a7f67c4496d6818ebd3f82","relation":"specification"}],"disposition":"supported","id":"hunk:sha256:3f4209c3f3db467049c593e717e61d78213c012bca098260947ed396d386e293","newRange":{"count":140,"start":1},"oldRange":{"count":0,"start":0},"path":"internal/cem/cli/out_of_tree_map_test.go","reason":"evidence-backed"},{"basis":[{"evidenceId":"evidence:sha256:d39170c99ef6c6a201635fe9dfcbdaa0799d4eab87e99620f3a1eb35e10b331b","relation":"specification"}],"disposition":"supported","id":"hunk:sha256:3daa648ece40183beb5ec3179aac83f414565d6d1f472e55f2b2e8740b369885","newRange":{"count":7,"start":6},"oldRange":{"count":6,"start":6},"path":"internal/cem/workflow/read.go","reason":"evidence-backed"},{"basis":[{"evidenceId":"evidence:sha256:1078611d55712ce55d2b8c939cfcec0e8ef210cc4975d02af0b5dbeda9b27e6d","relation":"specification"}],"disposition":"supported","id":"hunk:sha256:4d0f1a2bd0a873398a96a7496e02352c51ab101a7bc332f4306f8a3fc69bc038","newRange":{"count":13,"start":53},"oldRange":{"count":7,"start":52},"path":"internal/cem/workflow/read.go","reason":"evidence-backed"},{"basis":[{"evidenceId":"evidence:sha256:d39170c99ef6c6a201635fe9dfcbdaa0799d4eab87e99620f3a1eb35e10b331b","relation":"specification"},{"evidenceId":"evidence:sha256:da3bdac3a5bba9a7b83706df96b1efa2d3d8bec49631ed85ca921a1bb2e14256","relation":"specification"}],"disposition":"supported","id":"hunk:sha256:ba75d164f91168c2add18f2cd479caf147c2f9c0f077a1c8afb5f14983df164f","newRange":{"count":37,"start":104},"oldRange":{"count":6,"start":97},"path":"internal/cem/workflow/read.go","reason":"evidence-backed"},{"basis":[{"evidenceId":"evidence:sha256:1078611d55712ce55d2b8c939cfcec0e8ef210cc4975d02af0b5dbeda9b27e6d","relation":"specification"}],"disposition":"supported","id":"hunk:sha256:d7b83f078655e934c69981abd119306e91fa3544a53813655744b7fb80e89879","newRange":{"count":10,"start":151},"oldRange":{"count":7,"start":151},"path":"internal/cem/workflow/stable_read.go","reason":"evidence-backed"}],"patchSha256":"d7a5c880e9e107ec8f15282986eb7fa9d49a7eba0486c6b9324868a5ca9b7f5c","runnerReceipts":[],"spec":"cem/1.0"}
