{"artifacts":[],"baseRevision":"3194040043688bec1e479a3809952cd09c6ce8ae","criterionBindings":[],"criterionLinks":[],"evidence":[{"blobOid":"e91e19e3fb6e4ecf05d7715bf7e5877a5c20c0f3","id":"evidence:sha256:00f3abaad15de75df4c3322f56a9a8d8006f3da71919be824136633ad8f0f1c2","path":"AGENTS.md","span":{"end":3581,"start":3294},"spanSha256":"6038db7ea2a590906c73d3567e069fb1de4f7aac8b726aade4983e428427e59f"},{"blobOid":"38d6745607eebf536ef7dc3bda003aba9b211b49","id":"evidence:sha256:eded53fbc2f8300a5623b3b5e1546cb7017aeb104813a2f67dd3de29861a67c5","path":"docs/specs/corvint-tasks-pool-safe-reuse-v0.md","span":{"end":32247,"start":30353},"spanSha256":"4e6879410835a5a99a61eb7e6f003b2d9693a0e79b1d0ec58033b2d814dc5ff3"}],"excludedPath":".corvint/change.cem.json","hunks":[{"basis":[{"evidenceId":"evidence:sha256:00f3abaad15de75df4c3322f56a9a8d8006f3da71919be824136633ad8f0f1c2","relation":"specification"}],"disposition":"supported","id":"hunk:sha256:b49e7d5d769847f1d2f33867ef1db3c0b758f1dd779b398973548fba6e344d4d","newRange":{"count":7,"start":735},"oldRange":{"count":7,"start":735},"path":"docs/specs/INDEX.json","reason":"evidence-backed"},{"basis":[{"evidenceId":"evidence:sha256:00f3abaad15de75df4c3322f56a9a8d8006f3da71919be824136633ad8f0f1c2","relation":"specification"}],"disposition":"supported","id":"hunk:sha256:803c4684a7ca881eb9ee5fa75398180ec35fc1b8446cc1847cddab10451e692a","newRange":{"count":7,"start":38},"oldRange":{"count":7,"start":38},"path":"docs/specs/README.md","reason":"evidence-backed"},{"basis":[{"evidenceId":"evidence:sha256:00f3abaad15de75df4c3322f56a9a8d8006f3da71919be824136633ad8f0f1c2","relation":"specification"}],"disposition":"supported","id":"hunk:sha256:58f06b940da56a61d04262b731b4efee63012da0a515b36b4c95944ef7505ec3","newRange":{"count":14,"start":2969},"oldRange":{"count":6,"start":2969},"path":"docs/specs/REQUIREMENTS.tsv","reason":"evidence-backed"},{"basis":[{"evidenceId":"evidence:sha256:eded53fbc2f8300a5623b3b5e1546cb7017aeb104813a2f67dd3de29861a67c5","relation":"specification"}],"disposition":"supported","id":"hunk:sha256:30b9402667dce55ee888556c34b6e6703f84569c695862b440d2cd7df7f91802","newRange":{"count":14,"start":2},"oldRange":{"count":14,"start":2},"path":"docs/specs/corvint-tasks-pool-safe-reuse-v0.md","reason":"evidence-backed"},{"basis":[{"evidenceId":"evidence:sha256:eded53fbc2f8300a5623b3b5e1546cb7017aeb104813a2f67dd3de29861a67c5","relation":"specification"}],"disposition":"supported","id":"hunk:sha256:e028a9f4c3a44a60783dbadb8348f910feedc283110796f8c1ded3d6b7f4cfbc","newRange":{"count":137,"start":78},"oldRange":{"count":6,"start":78},"path":"docs/specs/corvint-tasks-pool-safe-reuse-v0.md","reason":"evidence-backed"},{"basis":[{"evidenceId":"evidence:sha256:eded53fbc2f8300a5623b3b5e1546cb7017aeb104813a2f67dd3de29861a67c5","relation":"specification"}],"disposition":"supported","id":"hunk:sha256:3153dee3d7024c13df60fbae29891d57990fbca41fec6fdf6b4ff9144e818fb2","newRange":{"count":16,"start":266},"oldRange":{"count":3,"start":135},"path":"docs/specs/corvint-tasks-pool-safe-reuse-v0.md","reason":"evidence-backed"}],"patchSha256":"60309d2594b52cd70c45a5cd160e74eced98cf9921cab7957d5f64e328259134","runnerReceipts":[],"spec":"cem/1.0"}
