{"artifacts":[],"baseRevision":"31feefe0337474f8fd0d68e3812e63cf90bc6767","criterionBindings":[],"criterionLinks":[],"evidence":[{"blobOid":"e91e19e3fb6e4ecf05d7715bf7e5877a5c20c0f3","id":"evidence:sha256:0e6fcaebb60889e8f45854e79249bd76e6ebbed92de4c96c11ce7515dd559abf","path":"AGENTS.md","span":{"end":4124,"start":3781},"spanSha256":"46e69c5e97297b36c204ff585b335a484633ade4ec166dbc695fd46e7c6dc76c"},{"blobOid":"e91e19e3fb6e4ecf05d7715bf7e5877a5c20c0f3","id":"evidence:sha256:5238e11fed2f9d5891ff352f4f2aa5b234ae2c9def3b7502b2e05a4ea128db0b","path":"AGENTS.md","span":{"end":3780,"start":3266},"spanSha256":"c7d11a0b982eb2201635eb2b707b8cdd00d1293b759e09871c243197f41ca672"},{"blobOid":"e91e19e3fb6e4ecf05d7715bf7e5877a5c20c0f3","id":"evidence:sha256:1bd123278e79bb2392d7cd301287fc6301f842cb6b8174df17fe871ea8f39ba6","path":"AGENTS.md","span":{"end":8021,"start":7623},"spanSha256":"3b4a0733b74ec4b138f74796565d24e63befa590145546763d3e3776b92ede6a"},{"blobOid":"535f7f6d2aaa08ed7d0943e9f26b535b3dd86ee1","id":"evidence:sha256:591e92487cdf7d8015f24c885d091835a07b015bf66555ee6606f23d59ce164a","path":"Makefile","span":{"end":12613,"start":12425},"spanSha256":"75e489a6134769c49a61b2ab18ba59e1cb38c2e3725f8bfdec97c197b5b7c050"},{"blobOid":"79f020f1f4741bb1785109d4eeb7264b1ae16538","id":"evidence:sha256:71b4eb75f638eddf03a8988cff5e4889ca67bf767a05219e925bc2b7610c58e8","path":"docs/specs/affected-plan-v0.md","span":{"end":34634,"start":33027},"spanSha256":"0372936ffe775caf2bfff8d31d6d188f68649f927ec3fc044a0c1d514ebb99ba"},{"blobOid":"79f020f1f4741bb1785109d4eeb7264b1ae16538","id":"evidence:sha256:1ecfe1d53587e223dd368d570ca60a4f84efb9f6975939373beea31788de83f6","path":"docs/specs/affected-plan-v0.md","span":{"end":35826,"start":34634},"spanSha256":"f70b81aec545621d573dd6294654292a31e96e53d2775d24501d01efd6390713"},{"blobOid":"8c25e37283820473b85a972a8617bac9787d6f48","id":"evidence:sha256:da68968c85cbca15619926783575553c2b5038e2e0fb2649ca2b824210c25f54","path":"tools/corvint-pr-tests/shadow.go","span":{"end":2342,"start":1873},"spanSha256":"0813aa7072fc970cd694fa014f818984bfb0c9538dfc1bcfe3ebda9cdf1817f2"},{"blobOid":"79f020f1f4741bb1785109d4eeb7264b1ae16538","id":"evidence:sha256:5322fb51942d56175f2115c2bb6bbc5c89e6b4713fe322d73c4a7f2074cf899f","path":"docs/specs/affected-plan-v0.md","span":{"end":153261,"start":153086},"spanSha256":"5fb3d43fb8ce2227b426c3abe6e6ed836e3968344e5abea495b4fa61b926a263"}],"excludedPath":".corvint/change.cem.json","hunks":[{"basis":[{"evidenceId":"evidence:sha256:0e6fcaebb60889e8f45854e79249bd76e6ebbed92de4c96c11ce7515dd559abf","relation":"specification"}],"disposition":"supported","id":"hunk:sha256:5e337c8bbdcdea57cf28329762db337a4d31a63eb50aa4a82166cc0d47118d66","newRange":{"count":13,"start":99},"oldRange":{"count":12,"start":99},"path":"docs/build-log/2026-10-16-ci-shadow-historical-compat.md","reason":"evidence-backed"},{"basis":[{"evidenceId":"evidence:sha256:5238e11fed2f9d5891ff352f4f2aa5b234ae2c9def3b7502b2e05a4ea128db0b","relation":"specification"}],"disposition":"supported","id":"hunk:sha256:285c2fbe83899587f34d68c8b9806c21666b8eb4d7389e1a5ea51350c4ea8e11","newRange":{"count":7,"start":38},"oldRange":{"count":7,"start":38},"path":"docs/specs/INDEX.json","reason":"evidence-backed"},{"basis":[{"evidenceId":"evidence:sha256:1bd123278e79bb2392d7cd301287fc6301f842cb6b8174df17fe871ea8f39ba6","relation":"specification"}],"disposition":"supported","id":"hunk:sha256:f06eab285f7d2e70c719139f51138f6dc04f7347f3f652b3e42a17960a71c1bb","newRange":{"count":7,"start":147},"oldRange":{"count":7,"start":147},"path":"docs/specs/README.md","reason":"evidence-backed"},{"basis":[{"evidenceId":"evidence:sha256:591e92487cdf7d8015f24c885d091835a07b015bf66555ee6606f23d59ce164a","relation":"specification"}],"disposition":"supported","id":"hunk:sha256:119b42066552c32e15407ee010482f68da520d7c79b6a384166299368247d901","newRange":{"count":7,"start":85},"oldRange":{"count":7,"start":85},"path":"docs/specs/REQUIREMENTS.tsv","reason":"evidence-backed"},{"basis":[{"evidenceId":"evidence:sha256:71b4eb75f638eddf03a8988cff5e4889ca67bf767a05219e925bc2b7610c58e8","relation":"specification"}],"disposition":"supported","id":"hunk:sha256:d6f81933f4673a8318324274cfc9abb928af4907fee9ffaa713173f457c2dea3","newRange":{"count":7,"start":3},"oldRange":{"count":7,"start":3},"path":"docs/specs/affected-plan-v0.md","reason":"evidence-backed"},{"basis":[{"evidenceId":"evidence:sha256:1ecfe1d53587e223dd368d570ca60a4f84efb9f6975939373beea31788de83f6","relation":"specification"}],"disposition":"supported","id":"hunk:sha256:417dc6a74d47592262da3ce4b971ee9c81d8d995ea0ac3e593c30ac44faf1d8b","newRange":{"count":7,"start":11},"oldRange":{"count":7,"start":11},"path":"docs/specs/affected-plan-v0.md","reason":"evidence-backed"},{"basis":[{"evidenceId":"evidence:sha256:da68968c85cbca15619926783575553c2b5038e2e0fb2649ca2b824210c25f54","relation":"specification"}],"disposition":"supported","id":"hunk:sha256:770e8bf1062f07fd3f0943a736cd8280f94d3adaf4bdd696007664a785c3391a","newRange":{"count":7,"start":1424},"oldRange":{"count":7,"start":1424},"path":"docs/specs/affected-plan-v0.md","reason":"evidence-backed"},{"basis":[{"evidenceId":"evidence:sha256:5322fb51942d56175f2115c2bb6bbc5c89e6b4713fe322d73c4a7f2074cf899f","relation":"specification"}],"disposition":"supported","id":"hunk:sha256:bbd58c91e650fc5ae7f0fa63d94523ea8e72af9a2658ef9167caf92eb64c51cf","newRange":{"count":7,"start":1568},"oldRange":{"count":7,"start":1568},"path":"docs/specs/affected-plan-v0.md","reason":"evidence-backed"}],"patchSha256":"2c08c8260a157a396ac914cf3d18f015a62c2d521e6f6b2e9d7b4ab3dc962978","runnerReceipts":[],"spec":"cem/1.0"}
