{"artifacts":[],"baseRevision":"c605450399873cca71193213c5aa4d3f7e43624b","criterionBindings":[],"criterionLinks":[],"evidence":[{"blobOid":"480c38620417e6e464bd01b093579a65379e6beb","id":"evidence:sha256:76b8d4d4fb140b0384d27ac5d9dbe2b299e40cf2dc832bcf469743c0d4145938","path":"internal/jstestprovider/qualified-reporter_test.cjs","span":{"end":39193,"start":37420},"spanSha256":"b972e1fa47c324e74fe8572053c57eff08b89352d800858a8e418887956116e0"},{"blobOid":"b40f5ed509040e0acc4ace162ec8bccde024f436","id":"evidence:sha256:f31e9834adddd01206c4e47c4c47e6407c6c8b0905942dfcb4960e31b1f9bfe1","path":"internal/jstestprovider/qualified-reporter.cjs","span":{"end":40885,"start":40412},"spanSha256":"25db304d2dc9be4e97fe44ef6e6157a87fd636d278d1adc5759024b8df5c289f"}],"excludedPath":".corvint/change.cem.json","hunks":[{"basis":[{"evidenceId":"evidence:sha256:76b8d4d4fb140b0384d27ac5d9dbe2b299e40cf2dc832bcf469743c0d4145938","relation":"dependency"}],"disposition":"supported","id":"hunk:sha256:6c5a1dcc86189dc8dd735e4aa6b060a5de8955c487a895ab7b7ac41cdae9816a","newRange":{"count":34,"start":1},"oldRange":{"count":0,"start":0},"path":"docs/build-log/2026-11-01-sel-w22.md","reason":"evidence-backed"},{"basis":[{"evidenceId":"evidence:sha256:f31e9834adddd01206c4e47c4c47e6407c6c8b0905942dfcb4960e31b1f9bfe1","relation":"dependency"}],"disposition":"supported","id":"hunk:sha256:5345f5a7fd25d9637e0bacd8234af285d61d6bf7ecf93a1fca700b02fb24cdd0","newRange":{"count":30,"start":536},"oldRange":{"count":3,"start":536},"path":"internal/jstestprovider/qualified-reporter_test.cjs","reason":"evidence-backed"}],"patchSha256":"76188a433fb84a37a2084231a55028c04833cc95a0993d619cd98083046d6225","runnerReceipts":[],"spec":"cem/1.0"}
