{"artifacts":[],"baseRevision":"55b0c0f0901ca516705b1d6d6b43651c071e6ccd","criterionBindings":[],"criterionLinks":[],"evidence":[{"blobOid":"e91e19e3fb6e4ecf05d7715bf7e5877a5c20c0f3","id":"evidence:sha256:bda7c25f21b33c926454abe1a680ff292069f648a66911f04eca820ba16e1526","path":"AGENTS.md","span":{"end":4082,"start":3780},"spanSha256":"90faf33a59f92a87568cdabbc555cbbed3810935a9ee671637131b24ba905470"},{"blobOid":"e91e19e3fb6e4ecf05d7715bf7e5877a5c20c0f3","id":"evidence:sha256:0c41ebee7cf5080292ad1ef59d310208df04835c85b897b32f1a1d7cab57c4a5","path":"AGENTS.md","span":{"end":3480,"start":3294},"spanSha256":"de3e0b2777009ddfb9038d5a0464cd606af86da86e9fa06b990aa669ff5b1ff0"},{"blobOid":"e91e19e3fb6e4ecf05d7715bf7e5877a5c20c0f3","id":"evidence:sha256:00f3abaad15de75df4c3322f56a9a8d8006f3da71919be824136633ad8f0f1c2","path":"AGENTS.md","span":{"end":3581,"start":3294},"spanSha256":"6038db7ea2a590906c73d3567e069fb1de4f7aac8b726aade4983e428427e59f"},{"blobOid":"e91e19e3fb6e4ecf05d7715bf7e5877a5c20c0f3","id":"evidence:sha256:7ddb56cf63b38f3df8bef3fdc55fb5bc29bb6d41b5ae9637d53289c4f29fdc43","path":"AGENTS.md","span":{"end":3581,"start":3378},"spanSha256":"9a5165d2ea9322012664ebcfc23401c7f7e354028863151015c9246b884f474c"},{"blobOid":"e91e19e3fb6e4ecf05d7715bf7e5877a5c20c0f3","id":"evidence:sha256:0ca0b68ca069dfbbc7e9952302510e13a681ba6732972a68c85e2f66e60cbe70","path":"AGENTS.md","span":{"end":3175,"start":2977},"spanSha256":"d518e000339c66235d6b6887282414a85be84eaaab0dc0bb133df2270e6da872"},{"blobOid":"e91e19e3fb6e4ecf05d7715bf7e5877a5c20c0f3","id":"evidence:sha256:69cb0afc8bf3d35457b1beafbeae3f8e35be1e32a0dca642dc6ac489a9e76717","path":"AGENTS.md","span":{"end":3265,"start":2977},"spanSha256":"29bf8bf25de6e19c57bfee2b1fc98c3d85cbeabf2157578740a5eae467b3c916"},{"blobOid":"e91e19e3fb6e4ecf05d7715bf7e5877a5c20c0f3","id":"evidence:sha256:b71d5987f7696a8962c5a9b23ed1e3660ad414269ebf29f65a005bf12c68788d","path":"AGENTS.md","span":{"end":3480,"start":3293},"spanSha256":"5d226e53d387c4daebe251481ba679cb294ceff0de962cd12b4fec4af73c7143"},{"blobOid":"e91e19e3fb6e4ecf05d7715bf7e5877a5c20c0f3","id":"evidence:sha256:cb191f5a863b718b15578327458f377193c9d9b31bf786efbfebb75ed8b328f8","path":"AGENTS.md","span":{"end":3681,"start":3480},"spanSha256":"308165caa38d4462f9a3659e6f7f738afceec0cbf61410188375e991ee42bf43"},{"blobOid":"e91e19e3fb6e4ecf05d7715bf7e5877a5c20c0f3","id":"evidence:sha256:16c65eb1b2b0c460b59063c9c2d1afa68550cb650eecf31e25ecbf5fa348aa9a","path":"AGENTS.md","span":{"end":3780,"start":3581},"spanSha256":"76f444798810b8e814c26f80dc987a742686419ff249c342a53e5069dde374dd"},{"blobOid":"e91e19e3fb6e4ecf05d7715bf7e5877a5c20c0f3","id":"evidence:sha256:63cdb170ce171ed4f93a39bcdfacd4bf911158f59f373e7c856a9246f7b6ce01","path":"AGENTS.md","span":{"end":6571,"start":6264},"spanSha256":"551f3746892e04be4fcddc3a12da0b8feb47da0012562bb79ae0fa3e6f9c5e09"}],"excludedPath":".corvint/change.cem.json","hunks":[{"basis":[{"evidenceId":"evidence:sha256:bda7c25f21b33c926454abe1a680ff292069f648a66911f04eca820ba16e1526","relation":"specification"}],"disposition":"supported","id":"hunk:sha256:54c3ac53455e28c932b0448f33a3c08067ac1ef7b650450201a15af1bf41de21","newRange":{"count":122,"start":1},"oldRange":{"count":0,"start":0},"path":"docs/build-log/2026-10-15-v1-0887-1403-liveness-guard.md","reason":"evidence-backed"},{"basis":[{"evidenceId":"evidence:sha256:0c41ebee7cf5080292ad1ef59d310208df04835c85b897b32f1a1d7cab57c4a5","relation":"specification"}],"disposition":"supported","id":"hunk:sha256:6a6ed8720e884163bf4b858abf09c692dc31b292b0a33d7ac9301b385d94dbd1","newRange":{"count":7,"start":692},"oldRange":{"count":7,"start":692},"path":"docs/specs/INDEX.json","reason":"evidence-backed"},{"basis":[{"evidenceId":"evidence:sha256:00f3abaad15de75df4c3322f56a9a8d8006f3da71919be824136633ad8f0f1c2","relation":"specification"}],"disposition":"supported","id":"hunk:sha256:2a745a021be663a9c1d0a5c27f09b8a3012c4b02dd007b48fb75c1096840a5c9","newRange":{"count":7,"start":35},"oldRange":{"count":7,"start":35},"path":"docs/specs/README.md","reason":"evidence-backed"},{"basis":[{"evidenceId":"evidence:sha256:7ddb56cf63b38f3df8bef3fdc55fb5bc29bb6d41b5ae9637d53289c4f29fdc43","relation":"specification"}],"disposition":"supported","id":"hunk:sha256:e37418742d7924d0a235bfaee04e16d32309dea98adba0b0117d505b8e9d9967","newRange":{"count":225,"start":472},"oldRange":{"count":224,"start":472},"path":"docs/specs/REQUIREMENTS.tsv","reason":"evidence-backed"},{"basis":[{"evidenceId":"evidence:sha256:0ca0b68ca069dfbbc7e9952302510e13a681ba6732972a68c85e2f66e60cbe70","relation":"specification"}],"disposition":"supported","id":"hunk:sha256:fc6bba32d8f5c4c19a466d44eddb7b5429255fbd66ae83b62947fc1dc28aec5e","newRange":{"count":7,"start":3},"oldRange":{"count":7,"start":3},"path":"docs/specs/corvint-tasks-agent-leases-v0.md","reason":"evidence-backed"},{"basis":[{"evidenceId":"evidence:sha256:69cb0afc8bf3d35457b1beafbeae3f8e35be1e32a0dca642dc6ac489a9e76717","relation":"specification"}],"disposition":"supported","id":"hunk:sha256:e06ce8e73707592a95ddf0f7a127a5999459d18e8484c3897f400ddad44d3130","newRange":{"count":10,"start":39},"oldRange":{"count":10,"start":39},"path":"docs/specs/corvint-tasks-agent-leases-v0.md","reason":"evidence-backed"},{"basis":[{"evidenceId":"evidence:sha256:b71d5987f7696a8962c5a9b23ed1e3660ad414269ebf29f65a005bf12c68788d","relation":"specification"}],"disposition":"supported","id":"hunk:sha256:0cce88b0b3869a1a07a787c0712a388d7a4ef3a59951eb162d9cb52feae9c9e7","newRange":{"count":7,"start":138},"oldRange":{"count":6,"start":138},"path":"docs/specs/corvint-tasks-agent-leases-v0.md","reason":"evidence-backed"},{"basis":[{"evidenceId":"evidence:sha256:cb191f5a863b718b15578327458f377193c9d9b31bf786efbfebb75ed8b328f8","relation":"specification"}],"disposition":"supported","id":"hunk:sha256:3064b88e66a307e4b03ddcffdbb2817ea66919321331e81316909b53931ef4d7","newRange":{"count":42,"start":6079},"oldRange":{"count":6,"start":6078},"path":"docs/specs/corvint-tasks-agent-leases-v0.md","reason":"evidence-backed"},{"basis":[{"evidenceId":"evidence:sha256:16c65eb1b2b0c460b59063c9c2d1afa68550cb650eecf31e25ecbf5fa348aa9a","relation":"specification"}],"disposition":"supported","id":"hunk:sha256:d984ce957b7614f96ceb4660d402fd55ada9eaaf925bf3d0a75afcc1c84d9a59","newRange":{"count":7,"start":6748},"oldRange":{"count":6,"start":6711},"path":"docs/specs/corvint-tasks-agent-leases-v0.md","reason":"evidence-backed"},{"basis":[{"evidenceId":"evidence:sha256:63cdb170ce171ed4f93a39bcdfacd4bf911158f59f373e7c856a9246f7b6ce01","relation":"specification"}],"disposition":"supported","id":"hunk:sha256:fbb29673b1b91854d8ef977f23a25fa107ca4f3a7e655afa1aa24bceb7016fae","newRange":{"count":95,"start":1},"oldRange":{"count":0,"start":0},"path":"internal/tasks/store/liveness_history_test.go","reason":"evidence-backed"}],"patchSha256":"213c31ad7168969ffce7d84745131d212a02f049ad79da3fcf30a4c86a603f39","runnerReceipts":[],"spec":"cem/1.0"}
